[
  {
    "id": "county:hoima-bugahya-county",
    "name": "Bugahya County",
    "slug": "bugahya-county",
    "level": "county",
    "type": "county",
    "parent_id": "district:hoima",
    "region_id": "region:western",
    "subregion_id": "subregion:bunyoro",
    "status": "operational",
    "confidence": "verified",
    "effective_date": null,
    "source_ids": [
      "src-ec-admin-units-2022"
    ],
    "notes": null,
    "external_refs": {
      "hdx_pcode": "UG410601",
      "hdx_within_pcode": "UG410601"
    }
  },
  {
    "id": "county:hoima-kigorobya-county",
    "name": "Kigorobya County",
    "slug": "kigorobya-county",
    "level": "county",
    "type": "county",
    "parent_id": "district:hoima",
    "region_id": "region:western",
    "subregion_id": "subregion:bunyoro",
    "status": "operational",
    "confidence": "verified",
    "effective_date": null,
    "source_ids": [
      "src-ec-admin-units-2022"
    ],
    "notes": null,
    "external_refs": {
      "hdx_within_pcode": "UG4106"
    }
  },
  {
    "id": "county:kagadi-buyaga-east-county",
    "name": "Buyaga East County",
    "slug": "buyaga-east-county",
    "level": "county",
    "type": "county",
    "parent_id": "district:kagadi",
    "region_id": "region:western",
    "subregion_id": "subregion:bunyoro",
    "status": "operational",
    "confidence": "verified",
    "effective_date": null,
    "source_ids": [
      "src-ec-admin-units-2022"
    ],
    "notes": null,
    "external_refs": {
      "hdx_within_pcode": "UG4111"
    }
  },
  {
    "id": "county:kagadi-buyaga-west-county",
    "name": "Buyaga West County",
    "slug": "buyaga-west-county",
    "level": "county",
    "type": "county",
    "parent_id": "district:kagadi",
    "region_id": "region:western",
    "subregion_id": "subregion:bunyoro",
    "status": "operational",
    "confidence": "verified",
    "effective_date": null,
    "source_ids": [
      "src-ec-admin-units-2022"
    ],
    "notes": null,
    "external_refs": {
      "hdx_within_pcode": "UG4111"
    }
  },
  {
    "id": "county:kakumiro-bugangaizi-west-county",
    "name": "Bugangaizi West County",
    "slug": "bugangaizi-west-county",
    "level": "county",
    "type": "county",
    "parent_id": "district:kakumiro",
    "region_id": "region:western",
    "subregion_id": "subregion:bunyoro",
    "status": "operational",
    "confidence": "verified",
    "effective_date": null,
    "source_ids": [
      "src-ec-admin-units-2022"
    ],
    "notes": null,
    "external_refs": {
      "hdx_within_pcode": "UG4112"
    }
  },
  {
    "id": "county:kakumiro-bugangaizi-east-county",
    "name": "Bugangaizi East County",
    "slug": "bugangaizi-east-county",
    "level": "county",
    "type": "county",
    "parent_id": "district:kakumiro",
    "region_id": "region:western",
    "subregion_id": "subregion:bunyoro",
    "status": "operational",
    "confidence": "verified",
    "effective_date": null,
    "source_ids": [
      "src-ec-admin-units-2022"
    ],
    "notes": null,
    "external_refs": {
      "hdx_within_pcode": "UG4112"
    }
  },
  {
    "id": "county:kakumiro-bugangaizi-south-county",
    "name": "Bugangaizi South County",
    "slug": "bugangaizi-south-county",
    "level": "county",
    "type": "county",
    "parent_id": "district:kakumiro",
    "region_id": "region:western",
    "subregion_id": "subregion:bunyoro",
    "status": "operational",
    "confidence": "verified",
    "effective_date": null,
    "source_ids": [
      "src-ec-admin-units-2022"
    ],
    "notes": null,
    "external_refs": {
      "hdx_within_pcode": "UG4112"
    }
  },
  {
    "id": "county:kikuube-buhaguzi-county",
    "name": "Buhaguzi County",
    "slug": "buhaguzi-county",
    "level": "county",
    "type": "county",
    "parent_id": "district:kikuube",
    "region_id": "region:western",
    "subregion_id": "subregion:bunyoro",
    "status": "operational",
    "confidence": "verified",
    "effective_date": null,
    "source_ids": [
      "src-ec-admin-units-2022"
    ],
    "notes": null,
    "external_refs": {
      "hdx_pcode": "UG411801",
      "hdx_within_pcode": "UG411801"
    }
  },
  {
    "id": "county:kikuube-buhaguzi-east-county",
    "name": "Buhaguzi East County",
    "slug": "buhaguzi-east-county",
    "level": "county",
    "type": "county",
    "parent_id": "district:kikuube",
    "region_id": "region:western",
    "subregion_id": "subregion:bunyoro",
    "status": "operational",
    "confidence": "verified",
    "effective_date": null,
    "source_ids": [
      "src-ec-admin-units-2022"
    ],
    "notes": null,
    "external_refs": {
      "hdx_within_pcode": "UG4118"
    }
  },
  {
    "id": "county:kibaale-buyanja-county",
    "name": "Buyanja County",
    "slug": "buyanja-county",
    "level": "county",
    "type": "county",
    "parent_id": "district:kibaale",
    "region_id": "region:western",
    "subregion_id": "subregion:bunyoro",
    "status": "operational",
    "confidence": "verified",
    "effective_date": null,
    "source_ids": [
      "src-ec-admin-units-2022"
    ],
    "notes": null,
    "external_refs": {
      "hdx_pcode": "UG411701",
      "hdx_within_pcode": "UG411701"
    }
  },
  {
    "id": "county:kibaale-buyanja-east-county",
    "name": "Buyanja East County",
    "slug": "buyanja-east-county",
    "level": "county",
    "type": "county",
    "parent_id": "district:kibaale",
    "region_id": "region:western",
    "subregion_id": "subregion:bunyoro",
    "status": "operational",
    "confidence": "verified",
    "effective_date": null,
    "source_ids": [
      "src-ec-admin-units-2022"
    ],
    "notes": null,
    "external_refs": {
      "hdx_within_pcode": "UG4117"
    }
  },
  {
    "id": "county:masindi-bujenje-county",
    "name": "Bujenje County",
    "slug": "bujenje-county",
    "level": "county",
    "type": "county",
    "parent_id": "district:masindi",
    "region_id": "region:western",
    "subregion_id": "subregion:bunyoro",
    "status": "operational",
    "confidence": "verified",
    "effective_date": null,
    "source_ids": [
      "src-ec-admin-units-2022"
    ],
    "notes": null,
    "external_refs": {
      "hdx_within_pcode": "UG4125"
    }
  },
  {
    "id": "county:masindi-buruli-county",
    "name": "Buruli County",
    "slug": "buruli-county",
    "level": "county",
    "type": "county",
    "parent_id": "district:masindi",
    "region_id": "region:western",
    "subregion_id": "subregion:bunyoro",
    "status": "operational",
    "confidence": "verified",
    "effective_date": null,
    "source_ids": [
      "src-ec-admin-units-2022"
    ],
    "notes": null,
    "external_refs": {
      "hdx_within_pcode": "UG4125"
    }
  },
  {
    "id": "county:masindi-masindi-municipality",
    "name": "Masindi Municipality",
    "slug": "masindi-municipality",
    "level": "county",
    "type": "municipality",
    "parent_id": "district:masindi",
    "region_id": "region:western",
    "subregion_id": "subregion:bunyoro",
    "status": "operational",
    "confidence": "verified",
    "effective_date": null,
    "source_ids": [
      "src-ec-admin-units-2022"
    ],
    "notes": null,
    "external_refs": {
      "hdx_pcode": "UG412503",
      "hdx_within_pcode": "UG412503"
    }
  },
  {
    "id": "county:buliisa-buliisa-county",
    "name": "Buliisa County",
    "slug": "buliisa-county",
    "level": "county",
    "type": "county",
    "parent_id": "district:buliisa",
    "region_id": "region:western",
    "subregion_id": "subregion:bunyoro",
    "status": "operational",
    "confidence": "verified",
    "effective_date": null,
    "source_ids": [
      "src-ec-admin-units-2022"
    ],
    "notes": null,
    "external_refs": {
      "hdx_pcode": "UG410201",
      "hdx_within_pcode": "UG410201"
    }
  },
  {
    "id": "county:kiryandongo-kibanda-south-county",
    "name": "Kibanda South County",
    "slug": "kibanda-south-county",
    "level": "county",
    "type": "county",
    "parent_id": "district:kiryandongo",
    "region_id": "region:western",
    "subregion_id": "subregion:bunyoro",
    "status": "operational",
    "confidence": "verified",
    "effective_date": null,
    "source_ids": [
      "src-ec-admin-units-2022"
    ],
    "notes": null,
    "external_refs": {
      "hdx_within_pcode": "UG4120"
    }
  },
  {
    "id": "county:kiryandongo-kibanda-north-county",
    "name": "Kibanda North County",
    "slug": "kibanda-north-county",
    "level": "county",
    "type": "county",
    "parent_id": "district:kiryandongo",
    "region_id": "region:western",
    "subregion_id": "subregion:bunyoro",
    "status": "operational",
    "confidence": "verified",
    "effective_date": null,
    "source_ids": [
      "src-ec-admin-units-2022"
    ],
    "notes": null,
    "external_refs": {
      "hdx_within_pcode": "UG4120"
    }
  },
  {
    "id": "county:kiboga-kiboga-east-county",
    "name": "Kiboga East County",
    "slug": "kiboga-east-county",
    "level": "county",
    "type": "county",
    "parent_id": "district:kiboga",
    "region_id": "region:central",
    "subregion_id": "subregion:buganda",
    "status": "operational",
    "confidence": "verified",
    "effective_date": null,
    "source_ids": [
      "src-ec-admin-units-2022"
    ],
    "notes": null,
    "external_refs": {
      "hdx_within_pcode": "UG1011"
    }
  },
  {
    "id": "county:kiboga-kiboga-west-county",
    "name": "Kiboga West County",
    "slug": "kiboga-west-county",
    "level": "county",
    "type": "county",
    "parent_id": "district:kiboga",
    "region_id": "region:central",
    "subregion_id": "subregion:buganda",
    "status": "operational",
    "confidence": "verified",
    "effective_date": null,
    "source_ids": [
      "src-ec-admin-units-2022"
    ],
    "notes": null,
    "external_refs": {
      "hdx_within_pcode": "UG1011"
    }
  },
  {
    "id": "county:luwero-katikamu-county-north",
    "name": "Katikamu County North",